{
  "schema": "w.diagnostics/1",
  "case": "missing-type-name",
  "source": "negative/05-missing-type-name.w",
  "diagnostics": [
    {
      "code": "W-SYN-0005",
      "severity": "error",
      "message": "expected a type name after struct",
      "primary": {
        "start": {
          "row": 0,
          "column": 6,
          "byte": 6
        },
        "end": {
          "row": 0,
          "column": 6,
          "byte": 6
        }
      },
      "parser": {
        "kind": "MISSING",
        "expectedNode": "type_identifier"
      }
    }
  ]
}
