{
  "schema": "w.diagnostics/1",
  "case": "missing-binding-name",
  "source": "negative/01-missing-binding-name.w",
  "diagnostics": [
    {
      "code": "W-SYN-0001",
      "severity": "error",
      "message": "expected a binding name after let",
      "primary": {
        "start": {
          "row": 2,
          "column": 5,
          "byte": 34
        },
        "end": {
          "row": 2,
          "column": 5,
          "byte": 34
        }
      },
      "parser": {
        "kind": "MISSING",
        "expectedNode": "identifier"
      }
    }
  ]
}
