{
  "schema": "w.diagnostics/1",
  "case": "missing-import-from",
  "source": "negative/09-missing-import-from.w",
  "diagnostics": [
    {
      "code": "W-SYN-0009",
      "severity": "error",
      "message": "expected from before the logical module name",
      "primary": {
        "start": {
          "row": 0,
          "column": 0,
          "byte": 0
        },
        "end": {
          "row": 0,
          "column": 26,
          "byte": 26
        }
      },
      "parser": {
        "kind": "ERROR"
      }
    }
  ]
}
