{
  "schema": "w.diagnostics/1",
  "case": "missing-task-binding",
  "source": "negative/08-missing-task-binding.w",
  "diagnostics": [
    {
      "code": "W-SYN-0008",
      "severity": "error",
      "message": "expected a child binding after async let",
      "primary": {
        "start": {
          "row": 1,
          "column": 12,
          "byte": 36
        },
        "end": {
          "row": 1,
          "column": 13,
          "byte": 37
        }
      },
      "parser": {
        "kind": "ERROR"
      }
    }
  ]
}
