{
  "schema": "w.diagnostics/1",
  "case": "missing-foreign-language",
  "source": "negative/10-missing-foreign-language.w",
  "diagnostics": [
    {
      "code": "W-SYN-0010",
      "severity": "error",
      "message": "expected a language after foreign",
      "primary": {
        "start": {
          "row": 0,
          "column": 13,
          "byte": 13
        },
        "end": {
          "row": 0,
          "column": 21,
          "byte": 21
        }
      },
      "parser": {
        "kind": "ERROR"
      }
    }
  ]
}
