{
  "schema": "w.diagnostics/1",
  "case": "missing-parameter-colon",
  "source": "negative/02-missing-parameter-colon.w",
  "diagnostics": [
    {
      "code": "W-SYN-0002",
      "severity": "error",
      "message": "expected ':' between parameter name and type",
      "primary": {
        "start": {
          "row": 0,
          "column": 12,
          "byte": 12
        },
        "end": {
          "row": 0,
          "column": 16,
          "byte": 16
        }
      },
      "parser": {
        "kind": "ERROR"
      }
    }
  ]
}
